{
 "$schema": "https://raw.githubusercontent.com/roy-tong/roy-tong/main/schemas/agent-tools.schema.json",
 "schema_version": "1.0",
 "updated_at": "2026-08-31",
 "catalog_url": "https://raw.githubusercontent.com/roy-tong/roy-tong/main/agent-tools.json",
 "purpose": "Route a user task to the smallest suitable Roy Tong research tool without confusing discovery, installation, invocation, and successful output.",
 "router": {
  "skill": "find-research-tool",
  "preview_command": "gh skill preview roy-tong/roy-tong find-research-tool",
  "install_command": "gh skill install roy-tong/roy-tong find-research-tool --agent codex --scope user",
  "invoke_example": "Use find-research-tool to choose the right research tool for this task and give me the safest first successful action."
 },
 "tools": [
  {
   "id": "agentmeasure",
   "name": "AgentMeasure",
   "summary": "Check whether agent telemetry preserves measurement semantics across retries, operation grouping, token accounting, cache behavior, and evidence boundaries.",
   "match": [
    "agent observability semantics",
    "telemetry conformance",
    "retry accounting",
    "operation vs attempt",
    "LLM token accounting",
    "measurement invariants",
    "agent usage metrics",
    "遥测语义核查",
    "重试计数",
    "用量口径"
   ],
   "avoid": [
    "load testing",
    "general APM dashboards",
    "prompt evaluation frameworks"
   ],
   "repository": "https://github.com/roy-tong/AgentMeasure",
   "status": "public-beta",
   "surfaces": [
    {
     "type": "agent-skill",
     "name": "agentmeasure"
    },
    {
     "type": "local-cli",
     "name": "conformance/runners/run_metrics.py"
    }
   ],
   "input": [
    "telemetry fixtures (JSONL) or a mapped trace export",
    "the metric claims to check against the data"
   ],
   "output": [
    "per-invariant PASS / FAIL / AMBIGUOUS / UNPROVABLE",
    "coverage disclosure for what the data cannot decide",
    "reproducible conformance vectors"
   ],
   "invoke_example": "Use AgentMeasure to check whether retry handling inflates counted usage in this trace fixture, and tell me which invariants cannot be decided from this data.",
   "first_success": {
    "action": "Clone the repository, run the two-minute local demo, then run the conformance vectors.",
    "success": "demo-e2e.sh maps 42 calls to 84 canonical observations deterministically, and run_metrics.py reports 21/21 vectors PASS."
   },
   "constraints": [
    "The packaged conformance CLI is in development; runners currently live in the repository.",
    "Provider audit entry is email-first with a zero-install sample check."
   ],
   "privacy": "Fixtures and checks run locally by default; no telemetry leaves the machine.",
   "brand": "AgentMeasure",
   "skill": {
    "name": "agentmeasure",
    "preview_command": "gh skill preview roy-tong/AgentMeasure agentmeasure",
    "install_command": "gh skill install roy-tong/AgentMeasure agentmeasure --agent codex --scope user"
   }
  },
  {
   "id": "research-monitor",
   "name": "iRead Research Monitor",
   "brand": "iRead",
   "summary": "Continuously discover and review sources, collect authorized feeds, and produce evidence-aware daily, weekly, and monthly research updates.",
   "match": [
    "continuous research monitoring",
    "research subscription",
    "source discovery",
    "recurring research digest",
    "industry monitoring",
    "持续研究监测",
    "行业监测",
    "信源发现",
    "研究日报",
    "研究周报"
   ],
   "avoid": [
    "one-off web search",
    "summarize a supplied document",
    "generic RSS reader advice"
   ],
   "repository": "https://github.com/roy-tong/iRead",
   "status": "public-beta",
   "surfaces": [
    {
     "type": "agent-skill",
     "name": "iread"
    },
    {
     "type": "local-cli",
     "name": "bin/iread"
    }
   ],
   "skill": {
    "name": "iread",
    "preview_command": "gh skill preview roy-tong/iRead iread",
    "install_command": "gh skill install roy-tong/iRead iread --agent codex --scope user"
   },
   "input": [
    "one or more research fields",
    "report depth",
    "reviewed source changes",
    "collection authorization"
   ],
   "output": [
    "source proposal",
    "coverage audit",
    "daily, weekly, and monthly reports",
    "trend ledger"
   ],
   "invoke_example": "Use iRead to propose sources for home robotics. Do not collect or schedule anything until I approve the sources.",
   "first_success": {
    "action": "Run the installed iRead Skill's offline doctor and demo before creating a live subscription.",
    "success": "The demo creates local Markdown and JSON outputs and reports network_used: false and model_used: false."
   },
   "constraints": [
    "Live monitoring currently targets macOS and Python 3.9+.",
    "Collection, backfill, WeChat access, and schedules require the approvals declared by the tool."
   ],
   "privacy": "Configuration, credentials, collected articles, and reports remain local by default."
  },
  {
   "id": "user-demand-research",
   "name": "User Demand Research (SURE)",
   "brand": "SURE — Structured User Research with Evidence",
   "summary": "Turn a research goal, region, sample size, and platform types into an auditable demand-research study: platform feasibility from a reviewed GitHub open-source connector registry, quota planning, deterministic corpus signals, and a research-status report with E0-E5 evidence and counter-evidence gates.",
   "match": [
    "user demand research",
    "customer discovery",
    "voice of customer analysis",
    "Jobs to be Done evidence",
    "willingness to pay evidence",
    "opportunity validation",
    "social media listening for product decisions",
    "Reddit X YouTube Amazon review research",
    "open-source data connector review",
    "用户需求研究",
    "评论挖掘",
    "付费意愿",
    "机会验证",
    "证据分级",
    "场景研究",
    "调研报告",
    "社媒调研",
    "电商评论研究"
   ],
   "avoid": [
    "generic market sizing",
    "inventing personas without evidence",
    "treating feature mentions or likes as demand",
    "scraping platforms that block third-party collection"
   ],
   "repository": "https://github.com/roy-tong/user-demand-research",
   "status": "public",
   "surfaces": [
    {
     "type": "agent-skill",
     "name": "user-demand-research"
    },
    {
     "type": "local-cli",
     "name": "sure.py",
     "commands": [
      "plan",
      "init",
      "check",
      "signals",
      "report",
      "connectors"
     ]
    },
    {
     "type": "mcp-server",
     "name": "sure-research",
     "script": "skills/user-demand-research/scripts/sure_mcp.py",
     "tools": [
      "sure_plan",
      "sure_init",
      "sure_check",
      "sure_signals",
      "sure_report",
      "sure_connectors",
      "sure_platform_map"
     ]
    }
   ],
   "skill": {
    "name": "user-demand-research",
    "preview_command": "gh skill preview roy-tong/user-demand-research user-demand-research",
    "install_command": "gh skill install roy-tong/user-demand-research user-demand-research --agent codex --scope user"
   },
   "input": [
    "research goal (product, user, or scene)",
    "region (cn, overseas, or global) and optional market label",
    "sample size target",
    "platform types (forum, social, video, ecommerce, crowdfunding)",
    "or an existing corpus to audit"
   ],
   "output": [
    "platform feasibility and collection task list",
    "quota-allocated source plan and platform route matrices",
    "evidence records with E0-E5 grades and provenance",
    "deterministic corpus signals",
    "demand judgments with counter-evidence and gaps",
    "Chinese research-status report"
   ],
   "invoke_example": "Use user-demand-research to plan a study: goal 'AI 眼镜在海外社媒的用户不满与替代方案', region overseas, sample size 100000, platform types forum+social+video. Report feasibility and the next gate.",
   "first_success": {
    "action": "From a repository checkout, run python3 skills/user-demand-research/scripts/sure.py check examples/sample-study --stage full --write-report.",
    "success": "The synthetic sample returns status: pass with all three evidence chains verified, offline and dependency-free."
   },
   "constraints": [
    "Convenience samples do not support population prevalence or market-share claims.",
    "Only registry-supported open-source connectors may collect; blocked routes stay recorded gaps and are never replaced by commercial providers, merchant APIs, or login-based scraping.",
    "Reddit access requires an approved Data API app registered by 2026-09-30."
   ],
   "privacy": "The Skill does not require uploading research questions, source records, identities, or local paths to the maintainer."
  },
  {
   "id": "bilibili-video-to-transcript",
   "name": "Bilibili Video to Transcript",
   "brand": "Bilibili Transcript",
   "summary": "Convert public Bilibili videos into timestamped Markdown, SRT subtitles, structured ASR JSON, summaries, and a batch manifest.",
   "match": [
    "Bilibili transcript",
    "Bilibili video to text",
    "BV transcription",
    "Whisper subtitles",
    "video research ingestion",
    "B站视频转文字",
    "B站转写",
    "字幕提取",
    "BV号批量处理"
   ],
   "avoid": [
    "non-Bilibili media",
    "private or access-controlled videos",
    "summarizing a transcript already supplied"
   ],
   "repository": "https://github.com/roy-tong/bilibili-transcript-pipeline",
   "status": "public-beta",
   "surfaces": [
    {
     "type": "agent-skill",
     "name": "bilibili-transcript"
    },
    {
     "type": "local-cli",
     "name": "bili-transcript"
    }
   ],
   "skill": {
    "name": "bilibili-transcript",
    "preview_command": "gh skill preview roy-tong/bilibili-transcript-pipeline bilibili-transcript",
    "install_command": "gh skill install roy-tong/bilibili-transcript-pipeline bilibili-transcript --agent codex --scope user"
   },
   "input": [
    "one or more public Bilibili URLs or BV ids",
    "source language and transcribe or translate mode",
    "optional proper-noun prompt"
   ],